mysql> create database HARDWARE;
Query OK, 1 row affected (0.55 sec)

mysql> USE HARDWARE;
Database changed
mysql> CREATE TABLE ELECTRONIC_ITEMS(
    -> ITEM_ID INT(2) PRIMARY KEY,
    -> ITEM_NAME VARCHAR(15) NOT NULL,
    -> ITEM_COST INT(6),
    -> DATE_OF_MANUFACTURE VARCHAR(20),
    -> WARRANTY VARCHAR;
ERROR 1064 (42000): You have an error in your SQL syntax; check the manual that corresponds to your MySQL server version for the right syntax to use near '' at line 6
mysql> CREATE TABLE ELECTRONIC_ITEMS(
    ->     -> ITEM_ID INT(2) PRIMARY KEY,
    ->     -> ITEM_NAME VARCHAR(15) NOT NULL,
    ->     -> ITEM_COST INT(6),
    ->     -> DATE_OF_MANUFACTURE DATE,
    -> WARRANTY VARCHAR(20)
    -> );
ERROR 1064 (42000): You have an error in your SQL syntax; check the manual that corresponds to your MySQL server version for the right syntax to use near '-> ITEM_ID INT(2) PRIMARY KEY,
    -> ITEM_NAME VARCHAR(15) NOT NULL,
    -> ITE' at line 2
mysql> CREATE TABLE ELECTRONIC_ITEMS (
    ->     -> ITEM_ID INT(2) PRIMARY KEY,
    -> ITEM_NAME VARCHAR(15) NOT NULL,
    -> ITEM_COST INT(6),
    ->     -> DATE_OF_MANUFACTURE DATE,
    -> WARRANTY VARCHAR(20)
    -> );
ERROR 1064 (42000): You have an error in your SQL syntax; check the manual that corresponds to your MySQL server version for the right syntax to use near '-> ITEM_ID INT(2) PRIMARY KEY,
ITEM_NAME VARCHAR(15) NOT NULL,
ITEM_COST INT(6),' at line 2
mysql> USE HARDWARE;
Database changed
mysql> USE TABLE ELECTRONIC_ITEMS;
ERROR 1049 (42000): Unknown database 'table'
mysql> USE ELECTRONIC_ITEMS;
ERROR 1049 (42000): Unknown database 'electronic_items'
mysql> USE HARDWARE;
Database changed
mysql> CREATE TABLE ELECTRONICS_ITEMS (
    -> ITEM_ID INT(4) PRIMARY KEY,
    -> I_NAME VARCHAR(20) NOT NULL,
    -> I_COST INT(4) NOT NULL,
    -> DATE_OF_MANUFACTURED DATE,
    -> WARRANTY VARCHAR(20)
    -> );
Query OK, 0 rows affected, 2 warnings (2.47 sec)

mysql> SELECT * FROM ELECTRONIC_ITEMS;
ERROR 1146 (42S02): Table 'hardware.electronic_items' doesn't exist
mysql> SELECT * FROM ELECTRONICS_ITEMS;
Empty set (0.00 sec)

mysql> INSERT INTO ELECTRONICS_ITEMS VALUES('001','LED BULB','250',2021-01-01','A YEAR');
    '> INSERT INTO ELECTRONICS_ITEMS VALUES('001','LED BULB','250',2021-01-01','A YEAR');
ERROR 1064 (42000): You have an error in your SQL syntax; check the manual that corresponds to your MySQL server version for the right syntax to use near '','A YEAR');
INSERT INTO ELECTRONICS_ITEMS VALUES('001','LED BULB','250',2021-01' at line 1
mysql> INSERT INTO ELECTRONICS_ITEMS VALUES(001,'LED BULB',220,'021-01-0','A YEAR');
Query OK, 1 row affected (0.19 sec)

mysql> INSERT INTO ELECTRONICS_ITEMS VALUES(001,'LED BULB',220,'021-01-0','1 YEAR');
ERROR 1062 (23000): Duplicate entry '1' for key 'electronics_items.PRIMARY'
mysql> INSERT INTO ELECTRONICS_ITEMS VALUES(002,'PENDRIVE',400,'2021-02-20','2 YEARS');
Query OK, 1 row affected (0.23 sec)

mysql>
mysql> INSERT INTO ELECTRONICS_ITEMS VALUES(002,'KEYBOARD',1000,'2020-06-20','1 YEARS');
ERROR 1062 (23000): Duplicate entry '2' for key 'electronics_items.PRIMARY'
mysql> INSERT INTO ELECTRONICS_ITEMS VALUES(003,'KEYBOARD',1000,'2020-06-20','1 YEARS');
Query OK, 1 row affected (0.08 sec)

mysql> INSERT INTO ELECTRONICS_ITEMS VALUES(004,'INVERTER',9000,'2020-09-01','4 YEARS');
Query OK, 1 row affected (0.18 sec)

mysql> INSERT INTO ELECTRONICS_ITEMS VALUES(005,'USB_CABLE',300,'2021-06-01','1 YEAR');
Query OK, 1 row affected (0.49 sec)

mysql> INSERT INTO ELECTRONICS_ITEMS VALUES(006,'TRANSFORMER',250,'2021-08-02','1 YEAR');
Query OK, 1 row affected (0.17 sec)

mysql> INSERT INTO ELECTRONICS_ITEMS VALUES(006,'ADAPTER',750,'2021-04-03','1 YEAR');
ERROR 1062 (23000): Duplicate entry '6' for key 'electronics_items.PRIMARY'
mysql> INSERT INTO ELECTRONICS_ITEMS VALUES(007,'ADAPTER',750,'2021-04-03','1 YEAR');
Query OK, 1 row affected (0.20 sec)

mysql> INSERT INTO ELECTRONICS_ITEMS VALUES(007,'MULTIMETER',550,'2021-05-15','1 YEAR');
ERROR 1062 (23000): Duplicate entry '7' for key 'electronics_items.PRIMARY'
mysql> INSERT INTO ELECTRONICS_ITEMS VALUES(008,'MULTIMETER',550,'2021-05-15','1 YEAR');
Query OK, 1 row affected (0.30 sec)

mysql> SELECT * FROM ELECTRONICS_ITEMS;
+---------+-------------+--------+----------------------+----------+
| ITEM_ID | I_NAME      | I_COST | DATE_OF_MANUFACTURED | WARRANTY |
+---------+-------------+--------+----------------------+----------+
|       1 | LED BULB    |    220 | 0021-01-00           | A YEAR   |
|       2 | PENDRIVE    |    400 | 2021-02-20           | 2 YEARS  |
|       3 | KEYBOARD    |   1000 | 2020-06-20           | 1 YEARS  |
|       4 | INVERTER    |   9000 | 2020-09-01           | 4 YEARS  |
|       5 | USB_CABLE   |    300 | 2021-06-01           | 1 YEAR   |
|       6 | TRANSFORMER |    250 | 2021-08-02           | 1 YEAR   |
|       7 | ADAPTER     |    750 | 2021-04-03           | 1 YEAR   |
|       8 | MULTIMETER  |    550 | 2021-05-15           | 1 YEAR   |
+---------+-------------+--------+----------------------+----------+
8 rows in set (0.00 sec)

mysql> SELECT I_NAME,DATE_OF_MANUFACTURED FROM ELECTRONICS_ITEMS;
+-------------+----------------------+
| I_NAME      | DATE_OF_MANUFACTURED |
+-------------+----------------------+
| LED BULB    | 0021-01-00           |
| PENDRIVE    | 2021-02-20           |
| KEYBOARD    | 2020-06-20           |
| INVERTER    | 2020-09-01           |
| USB_CABLE   | 2021-06-01           |
| TRANSFORMER | 2021-08-02           |
| ADAPTER     | 2021-04-03           |
| MULTIMETER  | 2021-05-15           |
+-------------+----------------------+
8 rows in set (0.00 sec)

mysql> select * from ELECTRONICS_ITEMS WHERE COST='300';
ERROR 1054 (42S22): Unknown column 'COST' in 'where clause'
mysql> select * from ELECTRONICS_ITEMS WHERE I_COST='300';
+---------+-----------+--------+----------------------+----------+
| ITEM_ID | I_NAME    | I_COST | DATE_OF_MANUFACTURED | WARRANTY |
+---------+-----------+--------+----------------------+----------+
|       5 | USB_CABLE |    300 | 2021-06-01           | 1 YEAR   |
+---------+-----------+--------+----------------------+----------+
1 row in set (0.10 sec)

mysql> select * from ELECTRONICS_ITEMS WHERE I_NAME='PENDRIVE';
+---------+----------+--------+----------------------+----------+
| ITEM_ID | I_NAME   | I_COST | DATE_OF_MANUFACTURED | WARRANTY |
+---------+----------+--------+----------------------+----------+
|       2 | PENDRIVE |    400 | 2021-02-20           | 2 YEARS  |
+---------+----------+--------+----------------------+----------+
1 row in set (0.00 sec)

mysql> SELECT * FROM ELECTRONICS_ITEMS WHERE I_NAME LIKE '%E_';
+---------+-------------+--------+----------------------+----------+
| ITEM_ID | I_NAME      | I_COST | DATE_OF_MANUFACTURED | WARRANTY |
+---------+-------------+--------+----------------------+----------+
|       4 | INVERTER    |   9000 | 2020-09-01           | 4 YEARS  |
|       6 | TRANSFORMER |    250 | 2021-08-02           | 1 YEAR   |
|       7 | ADAPTER     |    750 | 2021-04-03           | 1 YEAR   |
|       8 | MULTIMETER  |    550 | 2021-05-15           | 1 YEAR   |
+---------+-------------+--------+----------------------+----------+
4 rows in set (0.02 sec)

mysql> alter table ELECTRONICS_ITEMS
    -> add AVALABILITY VARCHAR(5);
Query OK, 0 rows affected (2.11 sec)
Records: 0  Duplicates: 0  Warnings: 0

mysql> select * from ELECTRONICS_ITEMS;
+---------+-------------+--------+----------------------+----------+-------------+
| ITEM_ID | I_NAME      | I_COST | DATE_OF_MANUFACTURED | WARRANTY | AVALABILITY |
+---------+-------------+--------+----------------------+----------+-------------+
|       1 | LED BULB    |    220 | 0021-01-00           | A YEAR   | NULL        |
|       2 | PENDRIVE    |    400 | 2021-02-20           | 2 YEARS  | NULL        |
|       3 | KEYBOARD    |   1000 | 2020-06-20           | 1 YEARS  | NULL        |
|       4 | INVERTER    |   9000 | 2020-09-01           | 4 YEARS  | NULL        |
|       5 | USB_CABLE   |    300 | 2021-06-01           | 1 YEAR   | NULL        |
|       6 | TRANSFORMER |    250 | 2021-08-02           | 1 YEAR   | NULL        |
|       7 | ADAPTER     |    750 | 2021-04-03           | 1 YEAR   | NULL        |
|       8 | MULTIMETER  |    550 | 2021-05-15           | 1 YEAR   | NULL        |
+---------+-------------+--------+----------------------+----------+-------------+
8 rows in set (0.01 sec)

mysql> UPDATE ELECTRONICS_ITEMS set AVALABILITY='YES';
Query OK, 8 rows affected (0.09 sec)
Rows matched: 8  Changed: 8  Warnings: 0

mysql> SELECT * FROM ELECTRONICS_ITEMS;
+---------+-------------+--------+----------------------+----------+-------------+
| ITEM_ID | I_NAME      | I_COST | DATE_OF_MANUFACTURED | WARRANTY | AVALABILITY |
+---------+-------------+--------+----------------------+----------+-------------+
|       1 | LED BULB    |    220 | 0021-01-00           | A YEAR   | YES         |
|       2 | PENDRIVE    |    400 | 2021-02-20           | 2 YEARS  | YES         |
|       3 | KEYBOARD    |   1000 | 2020-06-20           | 1 YEARS  | YES         |
|       4 | INVERTER    |   9000 | 2020-09-01           | 4 YEARS  | YES         |
|       5 | USB_CABLE   |    300 | 2021-06-01           | 1 YEAR   | YES         |
|       6 | TRANSFORMER |    250 | 2021-08-02           | 1 YEAR   | YES         |
|       7 | ADAPTER     |    750 | 2021-04-03           | 1 YEAR   | YES         |
|       8 | MULTIMETER  |    550 | 2021-05-15           | 1 YEAR   | YES         |
+---------+-------------+--------+----------------------+----------+-------------+
8 rows in set (0.06 sec)

mysql> UPDATE ELECTRONICS_ITEMS set AVALABILITY='NO'= WHERE I_NAME='INVERTER';
ERROR 1064 (42000): You have an error in your SQL syntax; check the manual that corresponds to your MySQL server version for the right syntax to use near 'WHERE I_NAME='INVERTER'' at line 1
mysql> SELECT * FROM ELECTRONICS_ITEMS ORDER BY I_COST asc;
+---------+-------------+--------+----------------------+----------+-------------+
| ITEM_ID | I_NAME      | I_COST | DATE_OF_MANUFACTURED | WARRANTY | AVALABILITY |
+---------+-------------+--------+----------------------+----------+-------------+
|       1 | LED BULB    |    220 | 0021-01-00           | A YEAR   | YES         |
|       6 | TRANSFORMER |    250 | 2021-08-02           | 1 YEAR   | YES         |
|       5 | USB_CABLE   |    300 | 2021-06-01           | 1 YEAR   | YES         |
|       2 | PENDRIVE    |    400 | 2021-02-20           | 2 YEARS  | YES         |
|       8 | MULTIMETER  |    550 | 2021-05-15           | 1 YEAR   | YES         |
|       7 | ADAPTER     |    750 | 2021-04-03           | 1 YEAR   | YES         |
|       3 | KEYBOARD    |   1000 | 2020-06-20           | 1 YEARS  | YES         |
|       4 | INVERTER    |   9000 | 2020-09-01           | 4 YEARS  | YES         |
+---------+-------------+--------+----------------------+----------+-------------+
8 rows in set (0.00 sec)

mysql> Select*from ELECTRONICS_ITEMS ORDER BY I_COST DESC;
+---------+-------------+--------+----------------------+----------+-------------+
| ITEM_ID | I_NAME      | I_COST | DATE_OF_MANUFACTURED | WARRANTY | AVALABILITY |
+---------+-------------+--------+----------------------+----------+-------------+
|       4 | INVERTER    |   9000 | 2020-09-01           | 4 YEARS  | YES         |
|       3 | KEYBOARD    |   1000 | 2020-06-20           | 1 YEARS  | YES         |
|       7 | ADAPTER     |    750 | 2021-04-03           | 1 YEAR   | YES         |
|       8 | MULTIMETER  |    550 | 2021-05-15           | 1 YEAR   | YES         |
|       2 | PENDRIVE    |    400 | 2021-02-20           | 2 YEARS  | YES         |
|       5 | USB_CABLE   |    300 | 2021-06-01           | 1 YEAR   | YES         |
|       6 | TRANSFORMER |    250 | 2021-08-02           | 1 YEAR   | YES         |
|       1 | LED BULB    |    220 | 0021-01-00           | A YEAR   | YES         |
+---------+-------------+--------+----------------------+----------+-------------+
8 rows in set (0.00 sec)

mysql> SELECT * FROM ELECTRONICS_ITEMS;
+---------+-------------+--------+----------------------+----------+-------------+
| ITEM_ID | I_NAME      | I_COST | DATE_OF_MANUFACTURED | WARRANTY | AVALABILITY |
+---------+-------------+--------+----------------------+----------+-------------+
|       1 | LED BULB    |    220 | 0021-01-00           | A YEAR   | YES         |
|       2 | PENDRIVE    |    400 | 2021-02-20           | 2 YEARS  | YES         |
|       3 | KEYBOARD    |   1000 | 2020-06-20           | 1 YEARS  | YES         |
|       4 | INVERTER    |   9000 | 2020-09-01           | 4 YEARS  | YES         |
|       5 | USB_CABLE   |    300 | 2021-06-01           | 1 YEAR   | YES         |
|       6 | TRANSFORMER |    250 | 2021-08-02           | 1 YEAR   | YES         |
|       7 | ADAPTER     |    750 | 2021-04-03           | 1 YEAR   | YES         |
|       8 | MULTIMETER  |    550 | 2021-05-15           | 1 YEAR   | YES         |
+---------+-------------+--------+----------------------+----------+-------------+
8 rows in set (0.00 sec)

mysql> SELECT * FROM ELECTRONICS_ITEMS WHERE I_COST IN('220','750');
+---------+----------+--------+----------------------+----------+-------------+
| ITEM_ID | I_NAME   | I_COST | DATE_OF_MANUFACTURED | WARRANTY | AVALABILITY |
+---------+----------+--------+----------------------+----------+-------------+
|       1 | LED BULB |    220 | 0021-01-00           | A YEAR   | YES         |
|       7 | ADAPTER  |    750 | 2021-04-03           | 1 YEAR   | YES         |
+---------+----------+--------+----------------------+----------+-------------+
2 rows in set (0.00 sec)

mysql> UPDATE ELECTRONICS_ITEMS
    -> SET DATE_OF_MANUFACTURED='2021-01-05'
    -> WHERE ITEM_ID='1';
Query OK, 1 row affected (0.10 sec)
Rows matched: 1  Changed: 1  Warnings: 0

mysql> SELECT * FROM ELECTRONICS_ITEMS;
+---------+-------------+--------+----------------------+----------+-------------+
| ITEM_ID | I_NAME      | I_COST | DATE_OF_MANUFACTURED | WARRANTY | AVALABILITY |
+---------+-------------+--------+----------------------+----------+-------------+
|       1 | LED BULB    |    220 | 2021-01-05           | A YEAR   | YES         |
|       2 | PENDRIVE    |    400 | 2021-02-20           | 2 YEARS  | YES         |
|       3 | KEYBOARD    |   1000 | 2020-06-20           | 1 YEARS  | YES         |
|       4 | INVERTER    |   9000 | 2020-09-01           | 4 YEARS  | YES         |
|       5 | USB_CABLE   |    300 | 2021-06-01           | 1 YEAR   | YES         |
|       6 | TRANSFORMER |    250 | 2021-08-02           | 1 YEAR   | YES         |
|       7 | ADAPTER     |    750 | 2021-04-03           | 1 YEAR   | YES         |
|       8 | MULTIMETER  |    550 | 2021-05-15           | 1 YEAR   | YES         |
+---------+-------------+--------+----------------------+----------+-------------+
8 rows in set (0.04 sec)

mysql> UPDATE ELECTRONICS_ITEMS
    -> SET WARRANTY='1 YEAR'
    -> WHERE ITEM_ID='1';
Query OK, 1 row affected (0.12 sec)
Rows matched: 1  Changed: 1  Warnings: 0

mysql> SELECT * FROM ELECTRONICS_ITEMS;
+---------+-------------+--------+----------------------+----------+-------------+
| ITEM_ID | I_NAME      | I_COST | DATE_OF_MANUFACTURED | WARRANTY | AVALABILITY |
+---------+-------------+--------+----------------------+----------+-------------+
|       1 | LED BULB    |    220 | 2021-01-05           | 1 YEAR   | YES         |
|       2 | PENDRIVE    |    400 | 2021-02-20           | 2 YEARS  | YES         |
|       3 | KEYBOARD    |   1000 | 2020-06-20           | 1 YEARS  | YES         |
|       4 | INVERTER    |   9000 | 2020-09-01           | 4 YEARS  | YES         |
|       5 | USB_CABLE   |    300 | 2021-06-01           | 1 YEAR   | YES         |
|       6 | TRANSFORMER |    250 | 2021-08-02           | 1 YEAR   | YES         |
|       7 | ADAPTER     |    750 | 2021-04-03           | 1 YEAR   | YES         |
|       8 | MULTIMETER  |    550 | 2021-05-15           | 1 YEAR   | YES         |
+---------+-------------+--------+----------------------+----------+-------------+
8 rows in set (0.00 sec)

mysql> UPDATE ELECTRONICS_ITEMS
    -> SET AVALABILITY='NO'
    -> WHERE ITEM_ID='5';
Query OK, 1 row affected (0.07 sec)
Rows matched: 1  Changed: 1  Warnings: 0

mysql> SELECT * FROM ELECTRONICS_ITEMS;
+---------+-------------+--------+----------------------+----------+-------------+
| ITEM_ID | I_NAME      | I_COST | DATE_OF_MANUFACTURED | WARRANTY | AVALABILITY |
+---------+-------------+--------+----------------------+----------+-------------+
|       1 | LED BULB    |    220 | 2021-01-05           | 1 YEAR   | YES         |
|       2 | PENDRIVE    |    400 | 2021-02-20           | 2 YEARS  | YES         |
|       3 | KEYBOARD    |   1000 | 2020-06-20           | 1 YEARS  | YES         |
|       4 | INVERTER    |   9000 | 2020-09-01           | 4 YEARS  | YES         |
|       5 | USB_CABLE   |    300 | 2021-06-01           | 1 YEAR   | NO          |
|       6 | TRANSFORMER |    250 | 2021-08-02           | 1 YEAR   | YES         |
|       7 | ADAPTER     |    750 | 2021-04-03           | 1 YEAR   | YES         |
|       8 | MULTIMETER  |    550 | 2021-05-15           | 1 YEAR   | YES         |
+---------+-------------+--------+----------------------+----------+-------------+
8 rows in set (0.11 sec)

mysql>




